Algorithm,Community (ID),Subreddit (Best Match),Score (Matching words),Keywords Community (Algorithm),Keywords Subreddit (Reality)
Leiden,1,Brawlstars,9/20,"new, deck, brawl, brawler, reddit, rules, low, cards, evo, better, yeah, removed, supercell, bad, level, brawlers, pass, stars, buffies, posts","brawlstars, questions, removed, rules, brawler, contact, brawl, thread, automatically, new, reddit, mega, low, using, wiki, discussion, brawlers, bot, moderators, posts"
Leiden,19,NoMansSkyTheGame,4/20,"ship, planet, freighter, save, base, space, build, expedition, corvette, ll, new, class, ships, systems, planets, sun, look, station, things, sure","flair, bug, question, bot, ship, answer, answered, help, nomansskythegame, questions, action, automatically, contact, moderators, planet, freighter, performed, compose, concerns, base"
Leiden,21,skyrim,4/20,"skyrim, bugs, said, mods, mod, thats, dont, fps, actually, smosh, far, jizz, look, youre, comment, 60, 360, joke, mean, im","skyrim, armor, mod, mods, level, quest, ll, did, lol, character, empire, actually, right, doesn, ulfric, better, kill, going, didn, damage"
Leiden,6,Destiny,20/20,"trump, right, shit, going, bad, did, actually, country, say, maduro, venezuela, doesn, war, thing, said, fucking, point, world, does, power","trump, right, shit, going, did, bad, country, actually, say, maduro, venezuela, doesn, war, thing, said, fucking, point, world, does, power"
Leiden,7,deadbydaylight,20/20,"killer, survivor, survivors, seconds, killers, fog, perks, unsummon, drawn, optout, dbd, fun, perk, power, new, ll, better, lol, doesn, actually","killer, survivor, survivors, seconds, killers, fog, perks, unsummon, drawn, optout, dbd, perk, fun, new, power, ll, better, lol, actually, doesn"
Leiden,4,Battlefield,20/20,"maps, battlefield, bf6, map, better, lol, bad, team, did, actually, new, player, bf, yeah, doesn, fun, cod, shit, point, say","maps, battlefield, bf6, map, better, lol, bad, team, bf, did, actually, player, new, cod, yeah, doesn, fun, shit, point, say"
Leiden,5,2007scape,20/20,"lol, content, account, did, doing, new, going, yeah, jagex, osrs, ll, bots, better, getting, actually, xp, sure, point, hours, lot","content, lol, account, did, doing, new, going, osrs, jagex, yeah, xp, getting, bots, ll, actually, better, hours, lot, sure, point"
Leiden,9,Minecraft,20/20,"comment, minecraft, quality, purpose, downvote, rules, breaks, does, fit, fits, poor, upvote, report, submission, reason, removal, 3a, removed, __, 0a","comment, minecraft, quality, purpose, downvote, rules, breaks, does, fit, poor, upvote, fits, report, submission, reason, removal, 3a, removed, __, 0a"
Leiden,14,DotA2,20/20,"dota, hero, team, score, heroes, lane, damage, doesn, mmr, enemy, items, better, mid, lol, bad, actually, lot, support, does, win","dota, team, hero, score, lane, heroes, damage, doesn, mmr, enemy, mid, items, better, lol, support, lot, actually, bad, win, does"
Leiden,12,ffxiv,19/20,"going, content, ll, new, ddos, level, lot, doesn, actually, doing, story, point, did, say, thing, isn, things, right, tank, long","content, going, ll, ddos, new, level, lot, actually, doing, doesn, point, story, did, ffxiv, thing, things, tank, say, isn, right"
Leiden,17,MonsterHunter,19/20,"monster, wilds, monsters, world, hunter, rise, fight, better, new, mh, doesn, did, lot, actually, damage, ll, weapon, yeah, pretty, thing","monster, wilds, monsters, world, hunter, rise, fight, better, mh, new, lot, did, doesn, damage, weapon, ll, actually, pretty, yeah, dragon"
Leiden,20,chess,19/20,"chess, position, magnus, world, moderators, player, best, moves, save, rating, classical, comment, removed, better, hikaru, engine, white, doesn, submission, black","chess, position, magnus, moderators, world, moves, best, player, rating, save, classical, removed, better, comment, white, lichess, hikaru, engine, black, doesn"
Leiden,11,skyrim,18/20,"skyrim, armor, level, quest, ll, mods, mod, did, lol, character, better, actually, damage, doesn, right, kill, going, empire, lot, sure","skyrim, armor, mod, mods, level, quest, ll, did, lol, character, empire, actually, right, doesn, ulfric, better, kill, going, didn, damage"
Leiden,16,DnD,18/20,"dm, character, level, rules, spell, player, party, going, things, spells, say, ll, fun, new, doesn, magic, campaign, lot, characters, maybe","character, dm, rules, level, spell, player, dnd, party, new, things, going, spells, characters, say, campaign, fun, ll, magic, does, doesn"
Leiden,18,residentevil,18/20,"leon, remake, chris, evil, resident, re4, story, ada, capcom, did, original, character, didn, lol, doesn, og, jill, different, say, yeah","leon, remake, evil, chris, resident, re4, story, ada, character, capcom, did, didn, jill, original, lol, og, horror, ll, say, yeah"
Leiden,0,Genshin_Impact,17/20,"characters, character, team, new, columbina, better, genshin, story, ll, ineffa, doesn, did, dps, actually, damage, does, lot, probably, yeah, didn","characters, character, team, columbina, new, ineffa, genshin, better, does, ll, story, reason, process, doesn, did, review, damage, actually, dps, probably"
Leiden,2,Overwatch,13/20,"questions, automatically, moderators, bot, action, contact, concerns, performed, compose, overwatch, posts, rules, spoilers, removed, flair, spoiler, bug, help, temple, new","overwatch, automatically, posts, questions, action, bot, following, concerns, contact, moderators, performed, compose, team, rules, common, bugs, patch, report, information, bug"
Leiden,13,BaldursGate3,13/20,"act, character, did, run, party, ll, level, doesn, fight, evil, didn, gale, astarion, lot, things, long, going, yeah, kill, sure","act, character, hot, did, action, check, run, baldursgate3, party, evil, ll, level, questions, fight, doesn, astarion, read, gale, didn, feel"
Leiden,15,leagueoflegends,13/20,"doesn, team, league, better, damage, riot, lot, player, new, say, actually, going, lol, lane, support, does, thing, win, elo, bad","team, league, doesn, better, damage, riot, leagueoflegends, read, removed, automatically, player, new, lot, rules, 100, lane, lol, actually, say, bot"
Leiden,8,FortNiteBR,12/20,"skin, fortnite, epic, skins, season, lol, new, free, yeah, player, did, ll, better, didn, getting, actually, fun, buy, chapter, lot","epic, fortnite, skin, skins, season, bot, questions, lol, player, free, team, new, contact, automatically, did, yeah, action, fortnitebr, performed, better"
Leiden,3,xbox,10/20,"xbox, switch, support, removed, new, issues, better, help, console, ll, going, years, community, doesn, did, pc, buy, ps5, didn, lot","xbox, support, issues, following, community, help, page, series, buy, console, program, posts, reason, potential, ll, contact, peer, pc, removed, thank"
Leiden,10,Battlefield,10/20,"team, tank, dps, support, better, doesn, hero, lol, damage, mercy, actually, right, point, new, vendetta, rank, say, yeah, bad, getting","maps, battlefield, bf6, map, better, lol, bad, team, bf, did, actually, player, new, cod, yeah, doesn, fun, shit, point, say"
Louvain,19,Brawlstars,9/20,"new, deck, brawl, brawler, reddit, rules, low, cards, evo, better, yeah, removed, bad, supercell, level, brawlers, pass, stars, posts, buffies","brawlstars, questions, removed, rules, brawler, contact, brawl, thread, automatically, new, reddit, mega, low, using, wiki, discussion, brawlers, bot, moderators, posts"
Louvain,9,residentevil,9/20,"switch, leon, remake, new, better, did, removed, doesn, didn, ll, lol, ps5, played, nintendo, does, yeah, going, say, comment, evil","leon, remake, evil, chris, resident, re4, story, ada, character, capcom, did, didn, jill, original, lol, og, horror, ll, say, yeah"
Louvain,15,skyrim,4/20,"skyrim, bugs, said, mods, mod, thats, dont, fps, actually, smosh, far, jizz, look, youre, comment, 60, 360, joke, mean, im","skyrim, armor, mod, mods, level, quest, ll, did, lol, character, empire, actually, right, doesn, ulfric, better, kill, going, didn, damage"
Louvain,0,deadbydaylight,20/20,"killer, survivor, survivors, seconds, killers, fog, perks, unsummon, drawn, optout, dbd, fun, power, perk, new, better, ll, actually, doesn, lol","killer, survivor, survivors, seconds, killers, fog, perks, unsummon, drawn, optout, dbd, perk, fun, new, power, ll, better, lol, actually, doesn"
Louvain,2,2007scape,20/20,"lol, content, account, did, doing, new, going, yeah, jagex, osrs, ll, getting, bots, actually, better, xp, sure, lot, hours, point","content, lol, account, did, doing, new, going, osrs, jagex, yeah, xp, getting, bots, ll, actually, better, hours, lot, sure, point"
Louvain,3,Minecraft,20/20,"comment, minecraft, quality, purpose, downvote, rules, breaks, does, fit, poor, fits, report, upvote, submission, reason, removal, 3a, removed, __, 0a","comment, minecraft, quality, purpose, downvote, rules, breaks, does, fit, poor, upvote, fits, report, submission, reason, removal, 3a, removed, __, 0a"
Louvain,12,Destiny,19/20,"trump, right, shit, going, bad, did, actually, say, country, maduro, venezuela, doesn, thing, war, said, fucking, point, world, does, isn","trump, right, shit, going, did, bad, country, actually, say, maduro, venezuela, doesn, war, thing, said, fucking, point, world, does, power"
Louvain,4,Battlefield,19/20,"maps, battlefield, bf6, map, better, lol, bad, team, did, actually, new, player, bf, yeah, doesn, fun, point, cod, shit, thing","maps, battlefield, bf6, map, better, lol, bad, team, bf, did, actually, player, new, cod, yeah, doesn, fun, shit, point, say"
Louvain,16,DotA2,19/20,"dota, team, hero, score, heroes, lane, doesn, damage, mmr, enemy, items, better, mid, lol, lot, actually, bad, support, does, report","dota, team, hero, score, lane, heroes, damage, doesn, mmr, enemy, mid, items, better, lol, support, lot, actually, bad, win, does"
Louvain,5,MonsterHunter,19/20,"monster, wilds, monsters, world, hunter, rise, fight, better, new, mh, doesn, did, lot, actually, ll, damage, pretty, yeah, thing, weapon","monster, wilds, monsters, world, hunter, rise, fight, better, mh, new, lot, did, doesn, damage, weapon, ll, actually, pretty, yeah, dragon"
Louvain,11,chess,19/20,"chess, position, magnus, world, moderators, player, best, moves, rating, save, classical, removed, comment, better, engine, white, hikaru, doesn, black, submission","chess, position, magnus, moderators, world, moves, best, player, rating, save, classical, removed, better, comment, white, lichess, hikaru, engine, black, doesn"
Louvain,6,skyrim,18/20,"skyrim, armor, level, quest, ll, did, mods, mod, lol, character, better, actually, doesn, damage, kill, lot, empire, going, right, yeah","skyrim, armor, mod, mods, level, quest, ll, did, lol, character, empire, actually, right, doesn, ulfric, better, kill, going, didn, damage"
Louvain,10,Genshin_Impact,17/20,"characters, character, team, new, columbina, better, genshin, story, ll, ineffa, doesn, did, actually, dps, damage, lot, does, yeah, probably, didn","characters, character, team, columbina, new, ineffa, genshin, better, does, ll, story, reason, process, doesn, did, review, damage, actually, dps, probably"
Louvain,17,DnD,16/20,"character, level, dm, party, spell, rules, going, ll, things, player, doesn, run, say, lot, did, spells, fun, characters, damage, new","character, dm, rules, level, spell, player, dnd, party, new, things, going, spells, characters, say, campaign, fun, ll, magic, does, doesn"
Louvain,8,xbox,14/20,"xbox, support, issues, help, removed, following, community, page, years, new, going, ll, better, buy, doesn, reason, point, pc, series, thank","xbox, support, issues, following, community, help, page, series, buy, console, program, posts, reason, potential, ll, contact, peer, pc, removed, thank"
Louvain,1,Overwatch,13/20,"questions, automatically, bot, moderators, action, contact, concerns, performed, compose, overwatch, posts, rules, spoilers, new, removed, flair, spoiler, bug, help, does","overwatch, automatically, posts, questions, action, bot, following, concerns, contact, moderators, performed, compose, team, rules, common, bugs, patch, report, information, bug"
Louvain,13,leagueoflegends,13/20,"doesn, league, team, damage, better, riot, player, lot, say, new, going, actually, lane, support, lol, does, thing, isn, elo, bad","team, league, doesn, better, damage, riot, leagueoflegends, read, removed, automatically, player, new, lot, rules, 100, lane, lol, actually, say, bot"
Louvain,7,FortNiteBR,12/20,"skin, fortnite, epic, skins, season, lol, free, new, yeah, did, player, ll, better, chapter, getting, didn, buy, actually, lot, fun","epic, fortnite, skin, skins, season, bot, questions, lol, player, free, team, new, contact, automatically, did, yeah, action, fortnitebr, performed, better"
Spectral,19,Battlefield,20/20,"maps, battlefield, bf6, map, better, lol, bad, team, did, actually, new, player, bf, yeah, doesn, fun, cod, shit, point, say","maps, battlefield, bf6, map, better, lol, bad, team, bf, did, actually, player, new, cod, yeah, doesn, fun, shit, point, say"
Spectral,0,Minecraft,19/20,"comment, minecraft, quality, purpose, downvote, rules, breaks, does, fit, poor, upvote, report, fits, removed, reason, submission, removal, 3a, new, __","comment, minecraft, quality, purpose, downvote, rules, breaks, does, fit, poor, upvote, fits, report, submission, reason, removal, 3a, removed, __, 0a"
Spectral,13,Destiny,19/20,"trump, right, shit, going, bad, did, actually, say, country, maduro, venezuela, doesn, thing, war, said, fucking, point, world, does, isn","trump, right, shit, going, did, bad, country, actually, say, maduro, venezuela, doesn, war, thing, said, fucking, point, world, does, power"
Spectral,9,PathOfExile2,15/20,"temple, league, build, damage, better, lot, doesn, going, maps, new, lol, actually, fun, map, level, right, run, did, try, items","temple, league, build, questions, damage, maps, try, run, topic, doesn, rooms, lot, map, currency, fun, better, level, div, new, going"
Spectral,15,2007scape,14/20,"chess, lol, did, new, content, better, going, player, account, doing, doesn, yeah, lot, say, best, point, actually, level, sure, ll","content, lol, account, did, doing, new, going, osrs, jagex, yeah, xp, getting, bots, ll, actually, better, hours, lot, sure, point"
Spectral,11,Overwatch,12/20,"questions, new, automatically, action, bot, contact, moderators, concerns, character, performed, compose, ll, doesn, does, better, going, overwatch, rules, did, posts","overwatch, automatically, posts, questions, action, bot, following, concerns, contact, moderators, performed, compose, team, rules, common, bugs, patch, report, information, bug"
